Simulating for 100 cycles...

Current register values :
-------------------------------------
PC: 0x00400010
Registers:
R0: 0x00000000
R1: 0x00000000
R2: 0x00000001
R3: 0x00000000
R4: 0xfffffff0
R5: 0x00000000
R6: 0x00000000
R7: 0x00000000
R8: 0x00000001
R9: 0x00000000
R10: 0x00000000
R11: 0x00000000
R12: 0x00000000
R13: 0x00000000
R14: 0x00000000
R15: 0x00000000
R16: 0x00000000
R17: 0x00000000
R18: 0x00000000
R19: 0x00000000
R20: 0x00000000
R21: 0x00000000
R22: 0x00000000
R23: 0x00000000
R24: 0x00000000
R25: 0x00000000
R26: 0x00000000
R27: 0x00000000
R28: 0x00000000
R29: 0x00000000
R30: 0x00000000
R31: 0x00400018

Memory content [0x00400000..0x00400010] :
-------------------------------------
0x00400000: 0xafa40000
0x00400004: 0x28880001
0x00400008: 0x11000001
0x0040000c: 0x20020001
0x00400010: 0x2084ffff

